tcpdump: verbose output suppressed, use -v or -vv for full protocol decode
listening on eno1, link-type EN10MB (Ethernet), capture size 262144 bytes
22:38:41.831625 IP 192.168.1.201.2796 > homs.15001: Flags [S], seq 19796, win 2720, options [mss 1360,nop,wscale 0,nop,nop,sackOK], length 0
22:38:44.140904 ARP, Request who-has 192.168.1.201 tell 192.168.1.201, length 46
22:38:48.098076 IP 192.168.1.201.16894 > homs.15001: Flags [S], seq 28738, win 2720, options [mss 1360,nop,wscale 0,nop,nop,sackOK], length 0
22:38:48.120631 IP 192.168.1.201.16894 > homs.15001: Flags [.], ack 3937951931, win 2720, length 0
22:38:48.137576 IP 192.168.1.201.16894 > homs.15001: Flags [P.], seq 0:1222, ack 1, win 2720, length 1222
22:38:48.155209 IP 192.168.1.201.16894 > homs.15001: Flags [P.], seq 1222:2444, ack 1, win 2720, length 1222
22:38:48.172838 IP 192.168.1.201.16894 > homs.15001: Flags [P.], seq 2444:3666, ack 1, win 2720, length 1222
22:38:48.190301 IP 192.168.1.201.16894 > homs.15001: Flags [P.], seq 3666:4888, ack 1, win 2720, length 1222
22:38:48.207896 IP 192.168.1.201.16894 > homs.15001: Flags [P.], seq 4888:6110, ack 1, win 2720, length 1222
22:38:48.225424 IP 192.168.1.201.16894 > homs.15001: Flags [P.], seq 6110:7332, ack 1, win 2720, length 1222
22:38:48.243010 IP 192.168.1.201.16894 > homs.15001: Flags [P.], seq 7332:8554, ack 1, win 2720, length 1222
22:38:48.260492 IP 192.168.1.201.16894 > homs.15001: Flags [P.], seq 8554:9776, ack 1, win 2720, length 1222
22:38:48.278259 IP 192.168.1.201.16894 > homs.15001: Flags [P.], seq 9776:10998, ack 1, win 2720, length 1222
22:38:48.295880 IP 192.168.1.201.16894 > homs.15001: Flags [P.], seq 10998:12220, ack 1, win 2720, length 1222
22:38:48.313485 IP 192.168.1.201.16894 > homs.15001: Flags [P.], seq 12220:13442, ack 1, win 2720, length 1222
22:38:48.331234 IP 192.168.1.201.16894 > homs.15001: Flags [P.], seq 13442:14664, ack 1, win 2720, length 1222
22:38:48.348820 IP 192.168.1.201.16894 > homs.15001: Flags [P.], seq 14664:15886, ack 1, win 2720, length 1222
22:38:48.366336 IP 192.168.1.201.16894 > homs.15001: Flags [P.], seq 15886:17108, ack 1, win 2720, length 1222
22:38:48.383926 IP 192.168.1.201.16894 > homs.15001: Flags [P.], seq 17108:18330, ack 1, win 2720, length 1222
22:38:48.401416 IP 192.168.1.201.16894 > homs.15001: Flags [P.], seq 18330:19552, ack 1, win 2720, length 1222
22:38:48.418998 IP 192.168.1.201.16894 > homs.15001: Flags [P.], seq 19552:20774, ack 1, win 2720, length 1222
22:38:48.429340 IP 192.168.1.201.16894 > homs.15001: Flags [P.], seq 20774:21996, ack 1, win 2720, length 1222
22:38:48.447013 IP 192.168.1.201.16894 > homs.15001: Flags [P.], seq 21996:23218, ack 1, win 2720, length 1222
22:38:48.460117 IP 192.168.1.201.16894 > homs.15001: Flags [P.], seq 23218:24440, ack 1, win 2720, length 1222
22:38:48.466395 IP 192.168.1.201.16894 > homs.15001: Flags [P.], seq 24440:25662, ack 1, win 2720, length 1222
22:38:48.481283 IP 192.168.1.201.16894 > homs.15001: Flags [P.], seq 25662:26884, ack 1, win 2720, length 1222
22:38:48.498967 IP 192.168.1.201.16894 > homs.15001: Flags [P.], seq 26884:28106, ack 1, win 2720, length 1222
22:38:48.509273 IP 192.168.1.201.16894 > homs.15001: Flags [P.], seq 28106:29328, ack 1, win 2720, length 1222
22:38:48.526950 IP 192.168.1.201.16894 > homs.15001: Flags [P.], seq 29328:30550, ack 1, win 2720, length 1222
22:38:48.537266 IP 192.168.1.201.16894 > homs.15001: Flags [P.], seq 30550:31772, ack 1, win 2720, length 1222
22:38:48.546177 IP 192.168.1.201.16894 > homs.15001: Flags [P.], seq 31772:32994, ack 1, win 2720, length 1222
22:38:48.565507 IP 192.168.1.201.16894 > homs.15001: Flags [P.], seq 32994:34216, ack 1, win 2720, length 1222
22:38:48.583332 IP 192.168.1.201.16894 > homs.15001: Flags [P.], seq 34216:35438, ack 1, win 2720, length 1222
22:38:48.593808 IP 192.168.1.201.16894 > homs.15001: Flags [P.], seq 35438:36660, ack 1, win 2720, length 1222
22:38:48.611349 IP 192.168.1.201.16894 > homs.15001: Flags [P.], seq 36660:37882, ack 1, win 2720, length 1222
22:38:48.621793 IP 192.168.1.201.16894 > homs.15001: Flags [P.], seq 37882:39104, ack 1, win 2720, length 1222
22:38:48.639324 IP 192.168.1.201.16894 > homs.15001: Flags [P.], seq 39104:40326, ack 1, win 2720, length 1222
22:38:48.649790 IP 192.168.1.201.16894 > homs.15001: Flags [P.], seq 40326:41548, ack 1, win 2720, length 1222
22:38:48.667341 IP 192.168.1.201.16894 > homs.15001: Flags [P.], seq 41548:42770, ack 1, win 2720, length 1222
22:38:48.677783 IP 192.168.1.201.16894 > homs.15001: Flags [P.], seq 42770:43992, ack 1, win 2720, length 1222
22:38:48.695290 IP 192.168.1.201.16894 > homs.15001: Flags [P.], seq 43992:45214, ack 1, win 2720, length 1222
22:38:48.705733 IP 192.168.1.201.16894 > homs.15001: Flags [P.], seq 45214:46436, ack 1, win 2720, length 1222
22:38:48.723314 IP 192.168.1.201.16894 > homs.15001: Flags [P.], seq 46436:47658, ack 1, win 2720, length 1222
22:38:48.733792 IP 192.168.1.201.16894 > homs.15001: Flags [P.], seq 47658:48880, ack 1, win 2720, length 1222
22:38:48.751305 IP 192.168.1.201.16894 > homs.15001: Flags [P.], seq 48880:50102, ack 1, win 2720, length 1222
22:38:48.761744 IP 192.168.1.201.16894 > homs.15001: Flags [P.], seq 50102:51324, ack 1, win 2720, length 1222
22:38:48.779309 IP 192.168.1.201.16894 > homs.15001: Flags [P.], seq 51324:52546, ack 1, win 2720, length 1222
22:38:48.789746 IP 192.168.1.201.16894 > homs.15001: Flags [P.], seq 52546:53768, ack 1, win 2720, length 1222
22:38:48.807295 IP 192.168.1.201.16894 > homs.15001: Flags [P.], seq 53768:54990, ack 1, win 2720, length 1222
22:38:48.817737 IP 192.168.1.201.16894 > homs.15001: Flags [P.], seq 54990:56212, ack 1, win 2720, length 1222
22:38:48.835283 IP 192.168.1.201.16894 > homs.15001: Flags [P.], seq 56212:57434, ack 1, win 2720, length 1222
22:38:48.845728 IP 192.168.1.201.16894 > homs.15001: Flags [P.], seq 57434:58656, ack 1, win 2720, length 1222
22:38:48.863251 IP 192.168.1.201.16894 > homs.15001: Flags [P.], seq 58656:59878, ack 1, win 2720, length 1222
22:38:48.873705 IP 192.168.1.201.16894 > homs.15001: Flags [P.], seq 59878:61100, ack 1, win 2720, length 1222
22:38:48.891282 IP 192.168.1.201.16894 > homs.15001: Flags [P.], seq 61100:62322, ack 1, win 2720, length 1222
22:38:48.901770 IP 192.168.1.201.16894 > homs.15001: Flags [P.], seq 62322:63544, ack 1, win 2720, length 1222
22:38:48.919271 IP 192.168.1.201.16894 > homs.15001: Flags [P.], seq 63544:64766, ack 1, win 2720, length 1222
22:38:48.929721 IP 192.168.1.201.16894 > homs.15001: Flags [P.], seq 64766:65988, ack 1, win 2720, length 1222
22:38:48.947315 IP 192.168.1.201.16894 > homs.15001: Flags [P.], seq 65988:67210, ack 1, win 2720, length 1222
22:38:48.964904 IP 192.168.1.201.16894 > homs.15001: Flags [P.], seq 67210:68432, ack 1, win 2720, length 1222
22:38:48.982404 IP 192.168.1.201.16894 > homs.15001: Flags [P.], seq 68432:69654, ack 1, win 2720, length 1222
22:38:48.999998 IP 192.168.1.201.16894 > homs.15001: Flags [P.], seq 69654:70876, ack 1, win 2720, length 1222
22:38:49.017534 IP 192.168.1.201.16894 > homs.15001: Flags [P.], seq 70876:72098, ack 1, win 2720, length 1222
22:38:49.035158 IP 192.168.1.201.16894 > homs.15001: Flags [P.], seq 72098:73320, ack 1, win 2720, length 1222
22:38:49.052760 IP 192.168.1.201.16894 > homs.15001: Flags [P.], seq 73320:74542, ack 1, win 2720, length 1222
22:38:49.070254 IP 192.168.1.201.16894 > homs.15001: Flags [P.], seq 74542:75764, ack 1, win 2720, length 1222
22:38:49.087887 IP 192.168.1.201.16894 > homs.15001: Flags [P.], seq 75764:76986, ack 1, win 2720, length 1222
22:38:49.105382 IP 192.168.1.201.16894 > homs.15001: Flags [P.], seq 76986:78208, ack 1, win 2720, length 1222
22:38:49.122980 IP 192.168.1.201.16894 > homs.15001: Flags [P.], seq 78208:79430, ack 1, win 2720, length 1222
22:38:49.140480 IP 192.168.1.201.16894 > homs.15001: Flags [P.], seq 79430:80652, ack 1, win 2720, length 1222
22:38:49.158244 IP 192.168.1.201.16894 > homs.15001: Flags [P.], seq 80652:81874, ack 1, win 2720, length 1222
22:38:49.175888 IP 192.168.1.201.16894 > homs.15001: Flags [P.], seq 81874:83096, ack 1, win 2720, length 1222
22:38:49.193345 IP 192.168.1.201.16894 > homs.15001: Flags [P.], seq 83096:84318, ack 1, win 2720, length 1222
22:38:49.211153 IP 192.168.1.201.16894 > homs.15001: Flags [P.], seq 84318:85540, ack 1, win 2720, length 1222
22:38:49.228753 IP 192.168.1.201.16894 > homs.15001: Flags [P.], seq 85540:86762, ack 1, win 2720, length 1222
22:38:49.246254 IP 192.168.1.201.16894 > homs.15001: Flags [P.], seq 86762:87984, ack 1, win 2720, length 1222
22:38:49.263854 IP 192.168.1.201.16894 > homs.15001: Flags [P.], seq 87984:89206, ack 1, win 2720, length 1222
22:38:49.281377 IP 192.168.1.201.16894 > homs.15001: Flags [P.], seq 89206:90428, ack 1, win 2720, length 1222
22:38:49.298980 IP 192.168.1.201.16894 > homs.15001: Flags [P.], seq 90428:91650, ack 1, win 2720, length 1222
22:38:49.316494 IP 192.168.1.201.16894 > homs.15001: Flags [P.], seq 91650:92872, ack 1, win 2720, length 1222
22:38:49.334216 IP 192.168.1.201.16894 > homs.15001: Flags [P.], seq 92872:94094, ack 1, win 2720, length 1222
22:38:49.351882 IP 192.168.1.201.16894 > homs.15001: Flags [P.], seq 94094:95316, ack 1, win 2720, length 1222
22:38:49.369350 IP 192.168.1.201.16894 > homs.15001: Flags [P.], seq 95316:96538, ack 1, win 2720, length 1222
22:38:49.386982 IP 192.168.1.201.16894 > homs.15001: Flags [P.], seq 96538:97760, ack 1, win 2720, length 1222
22:38:49.404457 IP 192.168.1.201.16894 > homs.15001: Flags [P.], seq 97760:98982, ack 1, win 2720, length 1222
22:38:49.422266 IP 192.168.1.201.16894 > homs.15001: Flags [P.], seq 98982:100204, ack 1, win 2720, length 1222
22:38:49.439865 IP 192.168.1.201.16894 > homs.15001: Flags [P.], seq 100204:101426, ack 1, win 2720, length 1222
22:38:49.457751 IP 192.168.1.201.16894 > homs.15001: Flags [P.], seq 101426:102648, ack 1, win 2720, length 1222
22:38:49.475456 IP 192.168.1.201.16894 > homs.15001: Flags [P.], seq 102648:103870, ack 1, win 2720, length 1222
22:38:49.493238 IP 192.168.1.201.16894 > homs.15001: Flags [P.], seq 103870:105092, ack 1, win 2720, length 1222
22:38:49.511024 IP 192.168.1.201.16894 > homs.15001: Flags [P.], seq 105092:106314, ack 1, win 2720, length 1222
22:38:49.528496 IP 192.168.1.201.16894 > homs.15001: Flags [P.], seq 106314:107536, ack 1, win 2720, length 1222
22:38:49.546132 IP 192.168.1.201.16894 > homs.15001: Flags [P.], seq 107536:108758, ack 1, win 2720, length 1222
22:38:49.563746 IP 192.168.1.201.16894 > homs.15001: Flags [P.], seq 108758:109980, ack 1, win 2720, length 1222
22:38:49.581256 IP 192.168.1.201.16894 > homs.15001: Flags [P.], seq 109980:111202, ack 1, win 2720, length 1222
22:38:49.598860 IP 192.168.1.201.16894 > homs.15001: Flags [P.], seq 111202:112424, ack 1, win 2720, length 1222
22:38:49.616355 IP 192.168.1.201.16894 > homs.15001: Flags [P.], seq 112424:113646, ack 1, win 2720, length 1222
22:38:49.633995 IP 192.168.1.201.16894 > homs.15001: Flags [P.], seq 113646:114868, ack 1, win 2720, length 1222
22:38:49.651498 IP 192.168.1.201.16894 > homs.15001: Flags [P.], seq 114868:116090, ack 1, win 2720, length 1222
22:38:49.669114 IP 192.168.1.201.16894 > homs.15001: Flags [P.], seq 116090:117312, ack 1, win 2720, length 1222
22:38:49.686764 IP 192.168.1.201.16894 > homs.15001: Flags [P.], seq 117312:118534, ack 1, win 2720, length 1222
22:38:49.704274 IP 192.168.1.201.16894 > homs.15001: Flags [P.], seq 118534:119756, ack 1, win 2720, length 1222
22:38:49.721882 IP 192.168.1.201.16894 > homs.15001: Flags [P.], seq 119756:120978, ack 1, win 2720, length 1222
22:38:49.739425 IP 192.168.1.201.16894 > homs.15001: Flags [P.], seq 120978:122200, ack 1, win 2720, length 1222
22:38:49.757014 IP 192.168.1.201.16894 > homs.15001: Flags [P.], seq 122200:123422, ack 1, win 2720, length 1222
22:38:49.774803 IP 192.168.1.201.16894 > homs.15001: Flags [P.], seq 123422:124644, ack 1, win 2720, length 1222
22:38:49.792280 IP 192.168.1.201.16894 > homs.15001: Flags [P.], seq 124644:125866, ack 1, win 2720, length 1222
22:38:49.809931 IP 192.168.1.201.16894 > homs.15001: Flags [P.], seq 125866:127088, ack 1, win 2720, length 1222
22:38:49.827377 IP 192.168.1.201.16894 > homs.15001: Flags [P.], seq 127088:128310, ack 1, win 2720, length 1222
22:38:49.844984 IP 192.168.1.201.16894 > homs.15001: Flags [P.], seq 128310:129532, ack 1, win 2720, length 1222
22:38:49.862443 IP 192.168.1.201.16894 > homs.15001: Flags [P.], seq 129532:130754, ack 1, win 2720, length 1222
22:38:49.880204 IP 192.168.1.201.16894 > homs.15001: Flags [P.], seq 130754:131976, ack 1, win 2720, length 1222
22:38:49.897785 IP 192.168.1.201.16894 > homs.15001: Flags [P.], seq 131976:133198, ack 1, win 2720, length 1222
22:38:49.915262 IP 192.168.1.201.16894 > homs.15001: Flags [P.], seq 133198:134420, ack 1, win 2720, length 1222
22:38:49.932868 IP 192.168.1.201.16894 > homs.15001: Flags [P.], seq 134420:135642, ack 1, win 2720, length 1222
22:38:49.950384 IP 192.168.1.201.16894 > homs.15001: Flags [P.], seq 135642:136864, ack 1, win 2720, length 1222
22:38:49.967948 IP 192.168.1.201.16894 > homs.15001: Flags [P.], seq 136864:138086, ack 1, win 2720, length 1222
22:38:49.985431 IP 192.168.1.201.16894 > homs.15001: Flags [P.], seq 138086:139308, ack 1, win 2720, length 1222
22:38:50.007835 IP 192.168.1.201.16894 > homs.15001: Flags [P.], seq 139308:140530, ack 1, win 2720, length 1222
22:38:50.025318 IP 192.168.1.201.16894 > homs.15001: Flags [P.], seq 140530:141752, ack 1, win 2720, length 1222
22:38:50.042902 IP 192.168.1.201.16894 > homs.15001: Flags [P.], seq 141752:142974, ack 1, win 2720, length 1222
22:38:50.060381 IP 192.168.1.201.16894 > homs.15001: Flags [P.], seq 142974:144196, ack 1, win 2720, length 1222
22:38:50.077971 IP 192.168.1.201.16894 > homs.15001: Flags [P.], seq 144196:145418, ack 1, win 2720, length 1222
22:38:50.095451 IP 192.168.1.201.16894 > homs.15001: Flags [P.], seq 145418:146640, ack 1, win 2720, length 1222
22:38:50.113176 IP 192.168.1.201.16894 > homs.15001: Flags [P.], seq 146640:147862, ack 1, win 2720, length 1222
22:38:50.130799 IP 192.168.1.201.16894 > homs.15001: Flags [P.], seq 147862:149084, ack 1, win 2720, length 1222
22:38:50.148282 IP 192.168.1.201.16894 > homs.15001: Flags [P.], seq 149084:150306, ack 1, win 2720, length 1222
22:38:50.166040 IP 192.168.1.201.16894 > homs.15001: Flags [P.], seq 150306:151528, ack 1, win 2720, length 1222
22:38:50.183489 IP 192.168.1.201.16894 > homs.15001: Flags [P.], seq 151528:152750, ack 1, win 2720, length 1222
22:38:50.201078 IP 192.168.1.201.16894 > homs.15001: Flags [P.], seq 152750:153972, ack 1, win 2720, length 1222
22:38:50.218695 IP 192.168.1.201.16894 > homs.15001: Flags [P.], seq 153972:155194, ack 1, win 2720, length 1222
22:38:50.236177 IP 192.168.1.201.16894 > homs.15001: Flags [P.], seq 155194:156416, ack 1, win 2720, length 1222
22:38:50.253763 IP 192.168.1.201.16894 > homs.15001: Flags [P.], seq 156416:157638, ack 1, win 2720, length 1222
22:38:50.271295 IP 192.168.1.201.16894 > homs.15001: Flags [P.], seq 157638:158860, ack 1, win 2720, length 1222
22:38:50.288885 IP 192.168.1.201.16894 > homs.15001: Flags [P.], seq 158860:160082, ack 1, win 2720, length 1222
22:38:50.306369 IP 192.168.1.201.16894 > homs.15001: Flags [P.], seq 160082:161304, ack 1, win 2720, length 1222
22:38:50.323933 IP 192.168.1.201.16894 > homs.15001: Flags [P.], seq 161304:162526, ack 1, win 2720, length 1222
22:38:50.341452 IP 192.168.1.201.16894 > homs.15001: Flags [P.], seq 162526:163748, ack 1, win 2720, length 1222
22:38:50.359049 IP 192.168.1.201.16894 > homs.15001: Flags [P.], seq 163748:164970, ack 1, win 2720, length 1222
22:38:50.376503 IP 192.168.1.201.16894 > homs.15001: Flags [P.], seq 164970:166192, ack 1, win 2720, length 1222
22:38:50.394118 IP 192.168.1.201.16894 > homs.15001: Flags [P.], seq 166192:167414, ack 1, win 2720, length 1222
22:38:50.411739 IP 192.168.1.201.16894 > homs.15001: Flags [P.], seq 167414:168636, ack 1, win 2720, length 1222
22:38:50.429237 IP 192.168.1.201.16894 > homs.15001: Flags [P.], seq 168636:169858, ack 1, win 2720, length 1222
22:38:50.446821 IP 192.168.1.201.16894 > homs.15001: Flags [P.], seq 169858:171080, ack 1, win 2720, length 1222
22:38:50.455700 IP 192.168.1.201.16894 > homs.15001: Flags [P.], seq 171080:172302, ack 1, win 2720, length 1222
22:38:50.482344 IP 192.168.1.201.16894 > homs.15001: Flags [P.], seq 172302:173524, ack 1, win 2720, length 1222
22:38:50.499962 IP 192.168.1.201.16894 > homs.15001: Flags [P.], seq 173524:174746, ack 1, win 2720, length 1222
22:38:50.517416 IP 192.168.1.201.16894 > homs.15001: Flags [P.], seq 174746:175968, ack 1, win 2720, length 1222
22:38:50.535165 IP 192.168.1.201.16894 > homs.15001: Flags [P.], seq 175968:177190, ack 1, win 2720, length 1222
22:38:50.552793 IP 192.168.1.201.16894 > homs.15001: Flags [P.], seq 177190:178412, ack 1, win 2720, length 1222
22:38:50.570281 IP 192.168.1.201.16894 > homs.15001: Flags [P.], seq 178412:179634, ack 1, win 2720, length 1222
22:38:50.587886 IP 192.168.1.201.16894 > homs.15001: Flags [P.], seq 179634:180856, ack 1, win 2720, length 1222
22:38:50.605410 IP 192.168.1.201.16894 > homs.15001: Flags [P.], seq 180856:182078, ack 1, win 2720, length 1222
22:38:50.623132 IP 192.168.1.201.16894 > homs.15001: Flags [P.], seq 182078:183300, ack 1, win 2720, length 1222
22:38:50.640762 IP 192.168.1.201.16894 > homs.15001: Flags [P.], seq 183300:184522, ack 1, win 2720, length 1222
22:38:50.658222 IP 192.168.1.201.16894 > homs.15001: Flags [P.], seq 184522:185744, ack 1, win 2720, length 1222
22:38:50.675994 IP 192.168.1.201.16894 > homs.15001: Flags [P.], seq 185744:186966, ack 1, win 2720, length 1222
22:38:50.693497 IP 192.168.1.201.16894 > homs.15001: Flags [P.], seq 186966:188188, ack 1, win 2720, length 1222
22:38:50.711114 IP 192.168.1.201.16894 > homs.15001: Flags [P.], seq 188188:189410, ack 1, win 2720, length 1222
22:38:50.728748 IP 192.168.1.201.16894 > homs.15001: Flags [P.], seq 189410:190632, ack 1, win 2720, length 1222
22:38:50.746283 IP 192.168.1.201.16894 > homs.15001: Flags [P.], seq 190632:191854, ack 1, win 2720, length 1222
22:38:50.763892 IP 192.168.1.201.16894 > homs.15001: Flags [P.], seq 191854:193076, ack 1, win 2720, length 1222
22:38:50.781400 IP 192.168.1.201.16894 > homs.15001: Flags [P.], seq 193076:194298, ack 1, win 2720, length 1222
22:38:50.799139 IP 192.168.1.201.16894 > homs.15001: Flags [P.], seq 194298:195520, ack 1, win 2720, length 1222
22:38:50.816819 IP 192.168.1.201.16894 > homs.15001: Flags [P.], seq 195520:196742, ack 1, win 2720, length 1222
22:38:50.834299 IP 192.168.1.201.16894 > homs.15001: Flags [P.], seq 196742:197964, ack 1, win 2720, length 1222
22:38:50.851933 IP 192.168.1.201.16894 > homs.15001: Flags [P.], seq 197964:199186, ack 1, win 2720, length 1222
22:38:50.869685 IP 192.168.1.201.16894 > homs.15001: Flags [P.], seq 199186:200408, ack 1, win 2720, length 1222
22:38:50.887196 IP 192.168.1.201.16894 > homs.15001: Flags [P.], seq 200408:201630, ack 1, win 2720, length 1222
22:38:50.904848 IP 192.168.1.201.16894 > homs.15001: Flags [P.], seq 201630:202852, ack 1, win 2720, length 1222
22:38:50.922357 IP 192.168.1.201.16894 > homs.15001: Flags [P.], seq 202852:204074, ack 1, win 2720, length 1222
22:38:50.939937 IP 192.168.1.201.16894 > homs.15001: Flags [P.], seq 204074:205296, ack 1, win 2720, length 1222
22:38:50.957475 IP 192.168.1.201.16894 > homs.15001: Flags [P.], seq 205296:206518, ack 1, win 2720, length 1222
22:38:50.975118 IP 192.168.1.201.16894 > homs.15001: Flags [P.], seq 206518:207740, ack 1, win 2720, length 1222
22:38:50.992723 IP 192.168.1.201.16894 > homs.15001: Flags [P.], seq 207740:208962, ack 1, win 2720, length 1222
22:38:51.010234 IP 192.168.1.201.16894 > homs.15001: Flags [P.], seq 208962:210184, ack 1, win 2720, length 1222
22:38:51.027885 IP 192.168.1.201.16894 > homs.15001: Flags [P.], seq 210184:211406, ack 1, win 2720, length 1222
22:38:51.045405 IP 192.168.1.201.16894 > homs.15001: Flags [P.], seq 211406:212628, ack 1, win 2720, length 1222
22:38:51.063145 IP 192.168.1.201.16894 > homs.15001: Flags [P.], seq 212628:213850, ack 1, win 2720, length 1222
22:38:51.080938 IP 192.168.1.201.16894 > homs.15001: Flags [P.], seq 213850:215072, ack 1, win 2720, length 1222
22:38:51.098451 IP 192.168.1.201.16894 > homs.15001: Flags [P.], seq 215072:216294, ack 1, win 2720, length 1222
22:38:51.116064 IP 192.168.1.201.16894 > homs.15001: Flags [P.], seq 216294:217516, ack 1, win 2720, length 1222
22:38:51.133677 IP 192.168.1.201.16894 > homs.15001: Flags [P.], seq 217516:218738, ack 1, win 2720, length 1222
22:38:51.151189 IP 192.168.1.201.16894 > homs.15001: Flags [P.], seq 218738:219960, ack 1, win 2720, length 1222
22:38:51.168867 IP 192.168.1.201.16894 > homs.15001: Flags [P.], seq 219960:221182, ack 1, win 2720, length 1222
22:38:51.186378 IP 192.168.1.201.16894 > homs.15001: Flags [P.], seq 221182:222404, ack 1, win 2720, length 1222
22:38:51.203994 IP 192.168.1.201.16894 > homs.15001: Flags [P.], seq 222404:223626, ack 1, win 2720, length 1222
22:38:51.221642 IP 192.168.1.201.16894 > homs.15001: Flags [P.], seq 223626:224848, ack 1, win 2720, length 1222
22:38:51.239152 IP 192.168.1.201.16894 > homs.15001: Flags [P.], seq 224848:226070, ack 1, win 2720, length 1222
22:38:51.256808 IP 192.168.1.201.16894 > homs.15001: Flags [P.], seq 226070:227292, ack 1, win 2720, length 1222
22:38:51.274318 IP 192.168.1.201.16894 > homs.15001: Flags [P.], seq 227292:228514, ack 1, win 2720, length 1222
22:38:51.291979 IP 192.168.1.201.16894 > homs.15001: Flags [P.], seq 228514:229736, ack 1, win 2720, length 1222
22:38:51.309636 IP 192.168.1.201.16894 > homs.15001: Flags [P.], seq 229736:230958, ack 1, win 2720, length 1222
22:38:51.327143 IP 192.168.1.201.16894 > homs.15001: Flags [P.], seq 230958:232180, ack 1, win 2720, length 1222
22:38:51.344791 IP 192.168.1.201.16894 > homs.15001: Flags [P.], seq 232180:233402, ack 1, win 2720, length 1222
22:38:51.362309 IP 192.168.1.201.16894 > homs.15001: Flags [P.], seq 233402:234624, ack 1, win 2720, length 1222
22:38:51.379955 IP 192.168.1.201.16894 > homs.15001: Flags [P.], seq 234624:235846, ack 1, win 2720, length 1222
22:38:51.397469 IP 192.168.1.201.16894 > homs.15001: Flags [P.], seq 235846:237068, ack 1, win 2720, length 1222
22:38:51.415155 IP 192.168.1.201.16894 > homs.15001: Flags [P.], seq 237068:238290, ack 1, win 2720, length 1222
22:38:51.432776 IP 192.168.1.201.16894 > homs.15001: Flags [P.], seq 238290:239512, ack 1, win 2720, length 1222
22:38:51.450335 IP 192.168.1.201.16894 > homs.15001: Flags [P.], seq 239512:240734, ack 1, win 2720, length 1222
22:38:51.467928 IP 192.168.1.201.16894 > homs.15001: Flags [P.], seq 240734:241956, ack 1, win 2720, length 1222
22:38:51.485615 IP 192.168.1.201.16894 > homs.15001: Flags [P.], seq 241956:243178, ack 1, win 2720, length 1222
22:38:51.503250 IP 192.168.1.201.16894 > homs.15001: Flags [P.], seq 243178:244400, ack 1, win 2720, length 1222
22:38:51.520929 IP 192.168.1.201.16894 > homs.15001: Flags [P.], seq 244400:245622, ack 1, win 2720, length 1222
22:38:51.538424 IP 192.168.1.201.16894 > homs.15001: Flags [P.], seq 245622:246844, ack 1, win 2720, length 1222
22:38:51.556101 IP 192.168.1.201.16894 > homs.15001: Flags [P.], seq 246844:248066, ack 1, win 2720, length 1222
22:38:51.573725 IP 192.168.1.201.16894 > homs.15001: Flags [P.], seq 248066:249288, ack 1, win 2720, length 1222
22:38:51.591280 IP 192.168.1.201.16894 > homs.15001: Flags [P.], seq 249288:250510, ack 1, win 2720, length 1222
22:38:51.608894 IP 192.168.1.201.16894 > homs.15001: Flags [P.], seq 250510:251732, ack 1, win 2720, length 1222
22:38:51.626608 IP 192.168.1.201.16894 > homs.15001: Flags [P.], seq 251732:252954, ack 1, win 2720, length 1222
22:38:51.644094 IP 192.168.1.201.16894 > homs.15001: Flags [P.], seq 252954:254176, ack 1, win 2720, length 1222
22:38:51.661843 IP 192.168.1.201.16894 > homs.15001: Flags [P.], seq 254176:255398, ack 1, win 2720, length 1222
22:38:51.679297 IP 192.168.1.201.16894 > homs.15001: Flags [P.], seq 255398:256620, ack 1, win 2720, length 1222
22:38:51.697012 IP 192.168.1.201.16894 > homs.15001: Flags [P.], seq 256620:257842, ack 1, win 2720, length 1222
22:38:51.714636 IP 192.168.1.201.16894 > homs.15001: Flags [P.], seq 257842:259064, ack 1, win 2720, length 1222
22:38:51.732191 IP 192.168.1.201.16894 > homs.15001: Flags [P.], seq 259064:260286, ack 1, win 2720, length 1222
22:38:51.749795 IP 192.168.1.201.16894 > homs.15001: Flags [P.], seq 260286:261508, ack 1, win 2720, length 1222
22:38:51.767359 IP 192.168.1.201.16894 > homs.15001: Flags [P.], seq 261508:262730, ack 1, win 2720, length 1222
22:38:51.784933 IP 192.168.1.201.16894 > homs.15001: Flags [P.], seq 262730:263952, ack 1, win 2720, length 1222
22:38:51.802598 IP 192.168.1.201.16894 > homs.15001: Flags [P.], seq 263952:265174, ack 1, win 2720, length 1222
22:38:51.820078 IP 192.168.1.201.16894 > homs.15001: Flags [P.], seq 265174:266396, ack 1, win 2720, length 1222
22:38:51.837740 IP 192.168.1.201.16894 > homs.15001: Flags [P.], seq 266396:267618, ack 1, win 2720, length 1222
22:38:51.855242 IP 192.168.1.201.16894 > homs.15001: Flags [P.], seq 267618:268840, ack 1, win 2720, length 1222
22:38:51.872882 IP 192.168.1.201.16894 > homs.15001: Flags [P.], seq 268840:270062, ack 1, win 2720, length 1222
22:38:51.890382 IP 192.168.1.201.16894 > homs.15001: Flags [P.], seq 270062:271284, ack 1, win 2720, length 1222
22:38:51.908161 IP 192.168.1.201.16894 > homs.15001: Flags [P.], seq 271284:272506, ack 1, win 2720, length 1222
22:38:51.925766 IP 192.168.1.201.16894 > homs.15001: Flags [P.], seq 272506:273728, ack 1, win 2720, length 1222
22:38:51.943328 IP 192.168.1.201.16894 > homs.15001: Flags [P.], seq 273728:274950, ack 1, win 2720, length 1222
22:38:51.960944 IP 192.168.1.201.16894 > homs.15001: Flags [P.], seq 274950:276172, ack 1, win 2720, length 1222
22:38:51.978444 IP 192.168.1.201.16894 > homs.15001: Flags [P.], seq 276172:277394, ack 1, win 2720, length 1222
22:38:51.996123 IP 192.168.1.201.16894 > homs.15001: Flags [P.], seq 277394:278616, ack 1, win 2720, length 1222
22:38:52.013730 IP 192.168.1.201.16894 > homs.15001: Flags [P.], seq 278616:279838, ack 1, win 2720, length 1222
22:38:52.031269 IP 192.168.1.201.16894 > homs.15001: Flags [P.], seq 279838:281060, ack 1, win 2720, length 1222
22:38:52.048871 IP 192.168.1.201.16894 > homs.15001: Flags [P.], seq 281060:282282, ack 1, win 2720, length 1222
22:38:52.066412 IP 192.168.1.201.16894 > homs.15001: Flags [P.], seq 282282:283504, ack 1, win 2720, length 1222
22:38:52.084028 IP 192.168.1.201.16894 > homs.15001: Flags [P.], seq 283504:284726, ack 1, win 2720, length 1222
22:38:52.101739 IP 192.168.1.201.16894 > homs.15001: Flags [P.], seq 284726:285948, ack 1, win 2720, length 1222
22:38:52.119203 IP 192.168.1.201.16894 > homs.15001: Flags [P.], seq 285948:287170, ack 1, win 2720, length 1222
22:38:52.136820 IP 192.168.1.201.16894 > homs.15001: Flags [P.], seq 287170:288392, ack 1, win 2720, length 1222
22:38:52.154684 IP 192.168.1.201.16894 > homs.15001: Flags [P.], seq 288392:289614, ack 1, win 2720, length 1222
22:38:52.172161 IP 192.168.1.201.16894 > homs.15001: Flags [P.], seq 289614:290836, ack 1, win 2720, length 1222
22:38:52.189798 IP 192.168.1.201.16894 > homs.15001: Flags [P.], seq 290836:292058, ack 1, win 2720, length 1222
22:38:52.207334 IP 192.168.1.201.16894 > homs.15001: Flags [P.], seq 292058:293280, ack 1, win 2720, length 1222
22:38:52.224980 IP 192.168.1.201.16894 > homs.15001: Flags [P.], seq 293280:294502, ack 1, win 2720, length 1222
22:38:52.242446 IP 192.168.1.201.16894 > homs.15001: Flags [P.], seq 294502:295724, ack 1, win 2720, length 1222
22:38:52.260092 IP 192.168.1.201.16894 > homs.15001: Flags [P.], seq 295724:296946, ack 1, win 2720, length 1222
22:38:52.277764 IP 192.168.1.201.16894 > homs.15001: Flags [P.], seq 296946:298168, ack 1, win 2720, length 1222
22:38:52.295309 IP 192.168.1.201.16894 > homs.15001: Flags [P.], seq 298168:299390, ack 1, win 2720, length 1222
22:38:52.312900 IP 192.168.1.201.16894 > homs.15001: Flags [P.], seq 299390:300612, ack 1, win 2720, length 1222
22:38:52.330414 IP 192.168.1.201.16894 > homs.15001: Flags [P.], seq 300612:301834, ack 1, win 2720, length 1222
22:38:52.348098 IP 192.168.1.201.16894 > homs.15001: Flags [P.], seq 301834:303056, ack 1, win 2720, length 1222
22:38:52.365856 IP 192.168.1.201.16894 > homs.15001: Flags [P.], seq 303056:304278, ack 1, win 2720, length 1222
22:38:52.383376 IP 192.168.1.201.16894 > homs.15001: Flags [P.], seq 304278:305500, ack 1, win 2720, length 1222
22:38:52.401105 IP 192.168.1.201.16894 > homs.15001: Flags [P.], seq 305500:306722, ack 1, win 2720, length 1222
22:38:52.418809 IP 192.168.1.201.16894 > homs.15001: Flags [P.], seq 306722:307944, ack 1, win 2720, length 1222
22:38:52.436285 IP 192.168.1.201.16894 > homs.15001: Flags [P.], seq 307944:309166, ack 1, win 2720, length 1222
22:38:52.453927 IP 192.168.1.201.16894 > homs.15001: Flags [P.], seq 309166:310388, ack 1, win 2720, length 1222
22:38:52.471401 IP 192.168.1.201.16894 > homs.15001: Flags [P.], seq 310388:311610, ack 1, win 2720, length 1222
22:38:52.489075 IP 192.168.1.201.16894 > homs.15001: Flags [P.], seq 311610:312832, ack 1, win 2720, length 1222
22:38:52.509391 IP 192.168.1.201.16894 > homs.15001: Flags [P.], seq 312832:314054, ack 1, win 2720, length 1222
22:38:52.517622 IP 192.168.1.201.16894 > homs.15001: Flags [P.], seq 314054:315276, ack 1, win 2720, length 1222
22:38:52.537792 IP 192.168.1.201.16894 > homs.15001: Flags [P.], seq 315276:316498, ack 1, win 2720, length 1222
22:38:52.546669 IP 192.168.1.201.16894 > homs.15001: Flags [P.], seq 316498:317720, ack 1, win 2720, length 1222
22:38:52.573359 IP 192.168.1.201.16894 > homs.15001: Flags [P.], seq 317720:318942, ack 1, win 2720, length 1222
22:38:52.591132 IP 192.168.1.201.16894 > homs.15001: Flags [P.], seq 318942:320164, ack 1, win 2720, length 1222
22:38:52.608746 IP 192.168.1.201.16894 > homs.15001: Flags [P.], seq 320164:321386, ack 1, win 2720, length 1222
22:38:52.626291 IP 192.168.1.201.16894 > homs.15001: Flags [P.], seq 321386:322608, ack 1, win 2720, length 1222
22:38:52.643895 IP 192.168.1.201.16894 > homs.15001: Flags [P.], seq 322608:323830, ack 1, win 2720, length 1222
22:38:52.661444 IP 192.168.1.201.16894 > homs.15001: Flags [P.], seq 323830:325052, ack 1, win 2720, length 1222
22:38:52.679092 IP 192.168.1.201.16894 > homs.15001: Flags [P.], seq 325052:326274, ack 1, win 2720, length 1222
22:38:52.696753 IP 192.168.1.201.16894 > homs.15001: Flags [P.], seq 326274:327496, ack 1, win 2720, length 1222
22:38:52.714586 IP 192.168.1.201.16894 > homs.15001: Flags [P.], seq 327496:328718, ack 1, win 2720, length 1222
22:38:52.732063 IP 192.168.1.201.16894 > homs.15001: Flags [P.], seq 328718:329940, ack 1, win 2720, length 1222
22:38:52.749735 IP 192.168.1.201.16894 > homs.15001: Flags [P.], seq 329940:331162, ack 1, win 2720, length 1222
22:38:52.767225 IP 192.168.1.201.16894 > homs.15001: Flags [P.], seq 331162:332384, ack 1, win 2720, length 1222
22:38:52.784869 IP 192.168.1.201.16894 > homs.15001: Flags [P.], seq 332384:333606, ack 1, win 2720, length 1222
22:38:52.802408 IP 192.168.1.201.16894 > homs.15001: Flags [P.], seq 333606:334828, ack 1, win 2720, length 1222
22:38:52.820026 IP 192.168.1.201.16894 > homs.15001: Flags [P.], seq 334828:336050, ack 1, win 2720, length 1222
22:38:52.837645 IP 192.168.1.201.16894 > homs.15001: Flags [P.], seq 336050:337272, ack 1, win 2720, length 1222
22:38:52.855132 IP 192.168.1.201.16894 > homs.15001: Flags [P.], seq 337272:338494, ack 1, win 2720, length 1222
22:38:52.872747 IP 192.168.1.201.16894 > homs.15001: Flags [P.], seq 338494:339716, ack 1, win 2720, length 1222
22:38:52.890264 IP 192.168.1.201.16894 > homs.15001: Flags [P.], seq 339716:340938, ack 1, win 2720, length 1222
22:38:52.907849 IP 192.168.1.201.16894 > homs.15001: Flags [P.], seq 340938:342160, ack 1, win 2720, length 1222
22:38:52.925374 IP 192.168.1.201.16894 > homs.15001: Flags [P.], seq 342160:343382, ack 1, win 2720, length 1222
22:38:52.942976 IP 192.168.1.201.16894 > homs.15001: Flags [P.], seq 343382:344604, ack 1, win 2720, length 1222
22:38:52.960597 IP 192.168.1.201.16894 > homs.15001: Flags [P.], seq 344604:345826, ack 1, win 2720, length 1222
22:38:52.978084 IP 192.168.1.201.16894 > homs.15001: Flags [P.], seq 345826:347048, ack 1, win 2720, length 1222
22:38:52.995674 IP 192.168.1.201.16894 > homs.15001: Flags [P.], seq 347048:348270, ack 1, win 2720, length 1222
22:38:53.013203 IP 192.168.1.201.16894 > homs.15001: Flags [P.], seq 348270:349492, ack 1, win 2720, length 1222
22:38:53.030790 IP 192.168.1.201.16894 > homs.15001: Flags [P.], seq 349492:350714, ack 1, win 2720, length 1222
22:38:53.048320 IP 192.168.1.201.16894 > homs.15001: Flags [P.], seq 350714:351936, ack 1, win 2720, length 1222
22:38:53.065909 IP 192.168.1.201.16894 > homs.15001: Flags [P.], seq 351936:353158, ack 1, win 2720, length 1222
22:38:53.083397 IP 192.168.1.201.16894 > homs.15001: Flags [P.], seq 353158:354380, ack 1, win 2720, length 1222
22:38:53.101029 IP 192.168.1.201.16894 > homs.15001: Flags [P.], seq 354380:355602, ack 1, win 2720, length 1222
22:38:53.118620 IP 192.168.1.201.16894 > homs.15001: Flags [P.], seq 355602:356824, ack 1, win 2720, length 1222
22:38:53.136127 IP 192.168.1.201.16894 > homs.15001: Flags [P.], seq 356824:358046, ack 1, win 2720, length 1222
22:38:53.153702 IP 192.168.1.201.16894 > homs.15001: Flags [P.], seq 358046:359268, ack 1, win 2720, length 1222
22:38:53.171207 IP 192.168.1.201.16894 > homs.15001: Flags [P.], seq 359268:360490, ack 1, win 2720, length 1222
22:38:53.188788 IP 192.168.1.201.16894 > homs.15001: Flags [P.], seq 360490:361712, ack 1, win 2720, length 1222
22:38:53.206290 IP 192.168.1.201.16894 > homs.15001: Flags [P.], seq 361712:362934, ack 1, win 2720, length 1222
22:38:53.223840 IP 192.168.1.201.16894 > homs.15001: Flags [P.], seq 362934:364156, ack 1, win 2720, length 1222
22:38:53.241346 IP 192.168.1.201.16894 > homs.15001: Flags [P.], seq 364156:365378, ack 1, win 2720, length 1222
22:38:53.259058 IP 192.168.1.201.16894 > homs.15001: Flags [P.], seq 365378:366600, ack 1, win 2720, length 1222
22:38:53.276701 IP 192.168.1.201.16894 > homs.15001: Flags [P.], seq 366600:367822, ack 1, win 2720, length 1222
22:38:53.294282 IP 192.168.1.201.16894 > homs.15001: Flags [P.], seq 367822:369044, ack 1, win 2720, length 1222
22:38:53.312079 IP 192.168.1.201.16894 > homs.15001: Flags [P.], seq 369044:370266, ack 1, win 2720, length 1222
22:38:53.329698 IP 192.168.1.201.16894 > homs.15001: Flags [P.], seq 370266:371488, ack 1, win 2720, length 1222
22:38:53.347180 IP 192.168.1.201.16894 > homs.15001: Flags [P.], seq 371488:372710, ack 1, win 2720, length 1222
22:38:53.364758 IP 192.168.1.201.16894 > homs.15001: Flags [P.], seq 372710:373932, ack 1, win 2720, length 1222
22:38:53.382264 IP 192.168.1.201.16894 > homs.15001: Flags [P.], seq 373932:375154, ack 1, win 2720, length 1222
22:38:53.399844 IP 192.168.1.201.16894 > homs.15001: Flags [P.], seq 375154:376376, ack 1, win 2720, length 1222
22:38:53.417317 IP 192.168.1.201.16894 > homs.15001: Flags [P.], seq 376376:377598, ack 1, win 2720, length 1222
22:38:53.435024 IP 192.168.1.201.16894 > homs.15001: Flags [P.], seq 377598:378820, ack 1, win 2720, length 1222
22:38:53.455370 IP 192.168.1.201.16894 > homs.15001: Flags [P.], seq 378820:380042, ack 1, win 2720, length 1222
22:38:53.461708 IP 192.168.1.201.16894 > homs.15001: Flags [P.], seq 380042:381264, ack 1, win 2720, length 1222
22:38:53.483858 IP 192.168.1.201.16894 > homs.15001: Flags [P.], seq 381264:382486, ack 1, win 2720, length 1222
22:38:53.501344 IP 192.168.1.201.16894 > homs.15001: Flags [P.], seq 382486:383708, ack 1, win 2720, length 1222
22:38:53.519103 IP 192.168.1.201.16894 > homs.15001: Flags [P.], seq 383708:384930, ack 1, win 2720, length 1222
22:38:53.536715 IP 192.168.1.201.16894 > homs.15001: Flags [P.], seq 384930:386152, ack 1, win 2720, length 1222
22:38:53.554316 IP 192.168.1.201.16894 > homs.15001: Flags [P.], seq 386152:387374, ack 1, win 2720, length 1222
22:38:53.572054 IP 192.168.1.201.16894 > homs.15001: Flags [P.], seq 387374:388596, ack 1, win 2720, length 1222
22:38:53.589634 IP 192.168.1.201.16894 > homs.15001: Flags [P.], seq 388596:389818, ack 1, win 2720, length 1222
22:38:53.607143 IP 192.168.1.201.16894 > homs.15001: Flags [P.], seq 389818:391040, ack 1, win 2720, length 1222
22:38:53.624726 IP 192.168.1.201.16894 > homs.15001: Flags [P.], seq 391040:392262, ack 1, win 2720, length 1222
22:38:53.642201 IP 192.168.1.201.16894 > homs.15001: Flags [P.], seq 392262:393484, ack 1, win 2720, length 1222
22:38:53.659783 IP 192.168.1.201.16894 > homs.15001: Flags [P.], seq 393484:394706, ack 1, win 2720, length 1222
22:38:53.677289 IP 192.168.1.201.16894 > homs.15001: Flags [P.], seq 394706:395928, ack 1, win 2720, length 1222
22:38:53.694841 IP 192.168.1.201.16894 > homs.15001: Flags [P.], seq 395928:397150, ack 1, win 2720, length 1222
22:38:53.712323 IP 192.168.1.201.16894 > homs.15001: Flags [P.], seq 397150:398372, ack 1, win 2720, length 1222
22:38:53.730035 IP 192.168.1.201.16894 > homs.15001: Flags [P.], seq 398372:399594, ack 1, win 2720, length 1222
22:38:53.747681 IP 192.168.1.201.16894 > homs.15001: Flags [P.], seq 399594:400816, ack 1, win 2720, length 1222
22:38:53.765131 IP 192.168.1.201.16894 > homs.15001: Flags [P.], seq 400816:402038, ack 1, win 2720, length 1222
22:38:53.782748 IP 192.168.1.201.16894 > homs.15001: Flags [P.], seq 402038:403260, ack 1, win 2720, length 1222
22:38:53.800196 IP 192.168.1.201.16894 > homs.15001: Flags [P.], seq 403260:404482, ack 1, win 2720, length 1222
22:38:53.817838 IP 192.168.1.201.16894 > homs.15001: Flags [P.], seq 404482:405704, ack 1, win 2720, length 1222
22:38:53.835292 IP 192.168.1.201.16894 > homs.15001: Flags [P.], seq 405704:406926, ack 1, win 2720, length 1222
22:38:53.852883 IP 192.168.1.201.16894 > homs.15001: Flags [P.], seq 406926:408148, ack 1, win 2720, length 1222
22:38:53.868595 IP 192.168.1.201.16894 > homs.15001: Flags [P.], seq 408148:408876, ack 1, win 2720, length 728
22:38:53.884015 IP 192.168.1.201.16894 > homs.15001: Flags [P.], seq 408876:409474, ack 1, win 2720, length 598
22:38:53.904735 IP 192.168.1.201.16894 > homs.15001: Flags [P.], seq 409474:410020, ack 1, win 2720, length 546
22:38:53.925730 IP 192.168.1.201.16894 > homs.15001: Flags [P.], seq 410020:410566, ack 1, win 2720, length 546
22:38:53.946777 IP 192.168.1.201.16894 > homs.15001: Flags [P.], seq 410566:411112, ack 1, win 2720, length 546
22:38:53.967736 IP 192.168.1.201.16894 > homs.15001: Flags [P.], seq 411112:411658, ack 1, win 2720, length 546
22:38:53.988738 IP 192.168.1.201.16894 > homs.15001: Flags [P.], seq 411658:412204, ack 1, win 2720, length 546
22:38:54.009734 IP 192.168.1.201.16894 > homs.15001: Flags [P.], seq 412204:412750, ack 1, win 2720, length 546
22:38:54.033927 IP 192.168.1.201.16894 > homs.15001: Flags [P.], seq 412750:413374, ack 1, win 2720, length 624
22:38:54.054736 IP 192.168.1.201.16894 > homs.15001: Flags [P.], seq 413374:413920, ack 1, win 2720, length 546
22:38:54.075714 IP 192.168.1.201.16894 > homs.15001: Flags [P.], seq 413920:414466, ack 1, win 2720, length 546
22:38:54.096769 IP 192.168.1.201.16894 > homs.15001: Flags [P.], seq 414466:415012, ack 1, win 2720, length 546
22:38:54.117720 IP 192.168.1.201.16894 > homs.15001: Flags [P.], seq 415012:415558, ack 1, win 2720, length 546
22:38:54.138764 IP 192.168.1.201.16894 > homs.15001: Flags [P.], seq 415558:416104, ack 1, win 2720, length 546
22:38:54.159724 IP 192.168.1.201.16894 > homs.15001: Flags [P.], seq 416104:416650, ack 1, win 2720, length 546
22:38:54.180734 IP 192.168.1.201.16894 > homs.15001: Flags [P.], seq 416650:417196, ack 1, win 2720, length 546
